,Cocktail Name,Glass,Ingredients,Instructions,combined,flavors,popularity
449,Round Pond Aperitif,Coupe,"luxardo aperitivo, round pond blood orange syrup, fresh lemon juice, 1 splash sparkling wine","Combine all ingredients except soda in a shaker with ice, shake to combine. Pour into a coupe glass and garnish with a lemon peel.","luxardo aperitivo, round pond blood orange syrup, fresh lemon juice, 1 splash sparkling wine,citrus",citrus,1.9212347318689424
450,Ruby Tuesday,Highball glass,"gin,cranberry juice,grenadine",Pour gin and cranberry into a highball filled with ice cubes. Add grenadine and stir.,"gin,cranberry juice,grenadine,fruity",fruity,0.8906237567473916
451,Rudolph's Rose,Coupe,"christmas spirit, luxardo maraschino liqueur, chateau de montifaud pineau des charentes rose, tempus fugit gran classico bitter",Combine all ingredients and stir with ice in a mixing glass. Strain into coupe glass and garnish with a Luxardo Cherry.,"christmas spirit, luxardo maraschino liqueur, chateau de montifaud pineau des charentes rose, tempus fugit gran classico bitter,floral,bitter","bitter, floral, sweet",2.0920839534874296
452,Sabotage,Rocks Glass,"breck bourbon, dancing pines black walnut bourbon, punt e mes, king's ginger liqueur","Muddle sage and Thyme. Stirred, over ice in single rocks glass. Burnt orange, and thyme sprig to garnish.","breck bourbon, dancing pines black walnut bourbon, punt e mes, king's ginger liqueur",,7.376827786646363
453,Sade's Taboo,Coupe,"h by hine, cocchi americano, dolin rouge vermouth, 1 dash bittermens hopped grapefruit bitters","Stir all the ingredients over ice, then strain into a coupe. No garnish.","h by hine, cocchi americano, dolin rouge vermouth, 1 dash bittermens hopped grapefruit bitters,fruity,bitter","bitter, fruity",1.3382250196483454
454,Sahara Glowing Heart,Nick & Nora,"junipero gin, apricot eau-de-vie, grenadine, 2 dash lemon bitters, 2 dash absinthe","Combine all ingredients in a mixing glass, add ice and then stir. Strain into a Nick & Nora glass and garnish with a lemon twist.","junipero gin, apricot eau-de-vie, grenadine, 2 dash lemon bitters, 2 dash absinthe,citrus,fruity,bitter","bitter, citrus, fruity",9.23873804379004
455,Salty Swede,Old Fashioned Glass,"karlsson's gold vodka, fresh grapefruit juice, club soda, 1 tincture grapefruit bitters",Combine the Karlsson's Gold Vodka and grapefruit in a shaker with ice. Shake for 15 seconds and strain over fresh ice in an old-fashioned glass that has a salted rim. Top the cocktail with the club soda.,"karlsson's gold vodka, fresh grapefruit juice, club soda, 1 tincture grapefruit bitters,fruity,bitter","bitter, fruity",3.5675758968854634
456,San Fran Shandy,,"hophead vodka, king's ginger liqueur, breckle's brown ale, fresh lemon juice, honey syrup, egg white, 2 dash angostura bitters","Combine Hophead, lemon juice, King's Ginger, honey syrup, egg white, and bitters in a shaker and dry shake to emulsify egg whites. Add ice and shake vigorously until proper dilution. Strain into a chilled fizz glass. Empty ice out of shakers and fill shaker with ale to create a froth. Pour this froth over the drink and garnish with half an orange wheel.
	
","hophead vodka, king's ginger liqueur, breckle's brown ale, fresh lemon juice, honey syrup, egg white, 2 dash angostura bitters,citrus,sweet,bitter","bitter, citrus, sweet",9.223778576572537
457,San Fran Soda,Pint Glass,"hophead vodka, fresh lime juice,  splash soda water,  top steam beer","Pour over ice in a pint glass, then fill with steam beer. Garnish with a lemon wedge and a straw.","hophead vodka, fresh lime juice,  splash soda water,  top steam beer,citrus",citrus,3.7600598944669104
458,Santa Patricia,Highball Glass,"blanco tequila, dry curacao, luxardo bitter, fresh ruby red grapefruit juice , cinnamon syrup",Shake all ingredients very well with ice and strain over ice into a highball glass.,"blanco tequila, dry curacao, luxardo bitter, fresh ruby red grapefruit juice , cinnamon syrup,fruity,bitter","bitter, fruity",1.7310684230846618
459,Sazerac,Old Fashioned Glass,"vieux pontarlier absinthe francaise superieure, h by hine, 3 dash tempus fugit abbott's bitters,  sugar","Rinse entire glass with absinthe, discard, if you must.
Stir with ice and strain into an old-fashion glass, garnish with lemon peel.","vieux pontarlier absinthe francaise superieure, h by hine, 3 dash tempus fugit abbott's bitters,  sugar,sweet,bitter","bitter, sweet",1.468426751519856
460,Scotch Joplin,Nick & Nora,"ardbeg ten, luxardo aperitivo, the genuine curacao liqueur orange, 5 dash orange bitters","Stir, strain into a chilled Nick and Nora glass. Garnish with lemon twist.","ardbeg ten, luxardo aperitivo, the genuine curacao liqueur orange, 5 dash orange bitters,citrus,bitter","bitter, citrus",9.015676087789313
461,See You T'Amaro,Small tumbler,"luxardo amaro abano, lemon juice, simple syrup, egg white, 1 dash fee bros rhubarb bitters","Combine all ingredients in shaker. Dry shake for 10 seconds, add ice and shake for 30 seconds. Strain into small tumbler. Garnish with a sprinkle of grated nutmeg.","luxardo amaro abano, lemon juice, simple syrup, egg white, 1 dash fee bros rhubarb bitters,citrus,sweet,bitter","bitter, citrus, sweet",1.843813622035527
462,Seersucker Sunshine,Nick & Nora,"luxardo bitter bianco, seersucker gin, lillet blanc, sauternes, 2 dash orange blossom water","Rinse the glass with Orange Blossom Water and pour cocktail. Shake Egg White, Sauternes and Lemon Juice vigorously dry for 25 seconds, then add ice, gin, Luxardo Bitter Bianco and Lillet Blanc, shake again for 10 seconds. Strain into Nick & Nora, garnish with a lemon wheel.","luxardo bitter bianco, seersucker gin, lillet blanc, sauternes, 2 dash orange blossom water,floral,citrus,bitter","bitter, citrus, floral",1.6470119807450228
463,Shadowcat,Coupe,"luxardo bitter bianco, barr hill gin, falernum, topo chico mineral water, 1 dash lemon bitters","Combine ingredients in a pint glass, stir with ice to chill. Double strain into a coupe glass. Garnish with mint and lemon wedge flag.","luxardo bitter bianco, barr hill gin, falernum, topo chico mineral water, 1 dash lemon bitters,citrus,bitter","bitter, citrus",9.1505247832825
464,Shark Attack,Pitcher,"lemonade,water,vodka",Mix lemonade and water according to instructions on back of can. If the instructions say to add 4 1/3 cans of water do so. Mix into pitcher. Add 1 1/of Vodka (Absolut). Mix well. Pour into glass of crushed ice. Excellent!,"lemonade,water,vodka,citrus",citrus,0.9233497273522852
465,Short Round,Punch Bowl,"bacardi superior rum, chateau de montifaud pineau des charentes blanc, lemon juice, velvet falernum","Build all ingredients in a punch bowl and add ice, stir gently. Garnish with seasonal fruit and citrus wheels.","bacardi superior rum, chateau de montifaud pineau des charentes blanc, lemon juice, velvet falernum,citrus",citrus,2.6320789568750964
466,Short Round II,Large Antique Vintage Shaker,"avuá prata cachaça, bacardi superior rum, chateau de montifaud pineau des charentes rose, lime juice, cannella cinnamon cordial, simple syrup",Build & Stir. Hoshizaki Ice.,"avuá prata cachaça, bacardi superior rum, chateau de montifaud pineau des charentes rose, lime juice, cannella cinnamon cordial, simple syrup,floral,citrus,sweet","citrus, floral, sweet",3.762846156623635
467,Sidecar,Coupe,"hine rare vsop, mathilde orange xo liqueur, lemon juice,  demerara syrup (2:1)",Shake. Strain into a coupe. Garnish with a lime twist.,"hine rare vsop, mathilde orange xo liqueur, lemon juice,  demerara syrup (2:1),citrus,sweet","citrus, sweet",1.89918130776394
468,Sidewinder,Coupe,"h by hine, apple brandy, benedictine, yellow chartreuse, 1 dash vieux pontarlier absinthe francaise superieure, 1 dash peychaud's bitters","Stir all the ingredients over ice, then strain into a coupe. No garnish.","h by hine, apple brandy, benedictine, yellow chartreuse, 1 dash vieux pontarlier absinthe francaise superieure, 1 dash peychaud's bitters,fruity,bitter","bitter, fruity",8.141266578628017
469,Simply Perfecto,Rocks Glass,barsol perfecto amor (aperitif wine),Pour Perfecto Amor over ice and garnish with an orange wheel.,barsol perfecto amor (aperitif wine),,1.501256960147883
470,Singapore Sling (1915 Recipe),Collins,"no.3 london dry gin, luxardo sangue morlacco cherry liqueur, luxardo triplum (triple sec), luxardo fernet, pineapple juice, fresh lime juice, 2 dash bitters",Shake ingredients with ice then strain into an ice-filled collins or pilsner glass.,"no.3 london dry gin, luxardo sangue morlacco cherry liqueur, luxardo triplum (triple sec), luxardo fernet, pineapple juice, fresh lime juice, 2 dash bitters,citrus,fruity,bitter","bitter, citrus, fruity",1.787593123356336
471,Sloe & Steady,Nick & Nora,"c. drouin calvados selection, spirit works sloe gin, bonal, 4 drops black salt tincture",Stir for about 20 seconds with ice and then Strain into a chilled Nick & Nora glass.,"c. drouin calvados selection, spirit works sloe gin, bonal, 4 drops black salt tincture",salty,1.4963101190920118
472,Smashing Great Pumpkins,Demitasse Glass,"pumpkin vodka, new york apple whisky, king's ginger liqueur, hot water",Steam in steaming tin. Pour in Demitasse glass. Top with heavy whipping cream and nutmeg.,"pumpkin vodka, new york apple whisky, king's ginger liqueur, hot water,fruity",fruity,2.4478152100240864
473,Smoke On The Dock,Collins,"luxardo fernet, mezcal, fresh lime sweet n' sour mix, pomegranate juice",Shake ingredients with ice then strain into a Collins glass.,"luxardo fernet, mezcal, fresh lime sweet n' sour mix, pomegranate juice,citrus",citrus,1.7658904691371964
474,Snow Bunny,Fizz Glass,"christmas spirit, king's ginger liqueur, lemon juice, honey syrup, egg white, ale, 3 drops dale degroff's pimento aromatic bitters","Combine all ingredients besides beer and bitters and dry shake without ice. Add ice and re-shake, double strain into a fizz glass and top with beer. Garnish with shaved nutmeg and 3 drops of bitters.","christmas spirit, king's ginger liqueur, lemon juice, honey syrup, egg white, ale, 3 drops dale degroff's pimento aromatic bitters,citrus,sweet,bitter","bitter, citrus, sweet",1.65683121835359
475,Soleo,,"luxardo limoncello, herbal liqueur",Use an empty bottle of 750ml capacity and combine together 12 ounces - of each of the two liqueurs and store in the freezer. Serve very cold in a small cordial glass without ice.,"luxardo limoncello, herbal liqueur",,2.380803161776494
476,Solera Sidecar,Coupe,"h by hine, lustau east india solera, grand marnier, luxardo amaretto di saschira, lemon juice, simple syrup","Shake all the ingredients with ice, then strain into a coupe. No garnish.","h by hine, lustau east india solera, grand marnier, luxardo amaretto di saschira, lemon juice, simple syrup,citrus,sweet","citrus, sweet",1.843813622035527
477,SOMA Fizz,Collins,"junipero gin, lemon juice, luxardo triplum (triple sec), heavy cream, 2 dash orange bitters, club soda",Pour 2 oz. of Club Soda into a Collin’s Glass. Hard shake first fIve ingredients with ice for at 20 seconds. Slowly strain into the Collins glass. Garnish with an orange wedge.,"junipero gin, lemon juice, luxardo triplum (triple sec), heavy cream, 2 dash orange bitters, club soda,citrus,fruity,bitter","bitter, citrus, fruity",1.753006342297856
478,Sorrentino,Rocks Glass,"luxardo limoncello, luxardo bitter, tempus fugit alessio vermouth di torino rosso, club soda,   fresh thyme","Place the thyme in a tumbler glass and muddle to release the oils, then add ice and ingredients, stir well and serve.","luxardo limoncello, luxardo bitter, tempus fugit alessio vermouth di torino rosso, club soda,   fresh thyme,bitter","bitter, herbaceous",1.5579474773819673
479,Sorriso (Adapted),Martini,"no.3 london dry gin, pear flavored vodka, luxardo sangue morlacco cherry liqueur, sherry, 2 dash bitters",Pour all ingredients in a mixing glass filled with ice. Stir well and strain into a chilled cocktail glass.,"no.3 london dry gin, pear flavored vodka, luxardo sangue morlacco cherry liqueur, sherry, 2 dash bitters,fruity,bitter","bitter, fruity",1.6344634046703244
480,Space Age Pop,,"1 1/chinaco reposado, luxardo amaro abano, 1/luxardo maraschino liqueur, 1/fresh lemon juice",Serve on one big rock.,"1 1/chinaco reposado, luxardo amaro abano, 1/luxardo maraschino liqueur, 1/fresh lemon juice,citrus","citrus, sweet",1.7120298651659562
481,Spice and Stormy,,"pink pigeon rum, simple syrup, lemon juice, luxardo bitter, 1 float ginger beer, 4 pieces pineapple, 4 pieces ginger root","Muddle pineapple and ginger root, lemon juice and simple syrup. Add rum. Shake well, over ice and top with ginger beer and Luxardo Bitter","pink pigeon rum, simple syrup, lemon juice, luxardo bitter, 1 float ginger beer, 4 pieces pineapple, 4 pieces ginger root,citrus,fruity,sweet,bitter","bitter, citrus, fruity, sweet",4.197326161088864
482,Spiced Marmalade,Coupe,"junipero gin, 1 bsp orange marmalade, lemon juice, orange juice, simple syrup, 2 dash orange bitters, 4  cloves torched & muddled","shake/2strain/coupe

garnish lemon twist","junipero gin, 1 bsp orange marmalade, lemon juice, orange juice, simple syrup, 2 dash orange bitters, 4  cloves torched & muddled,citrus,herbaceous,sweet,bitter","bitter, citrus, herbaceous, sweet",1.903371077512436
483,Spring Cleanse,Chilled Glass,"1  half small cucumber, 1  medium carrot, 1  green apple, cored, 3-4  kale leaves, 1  big handful spinach leaves, 1  small hunk ginger, .5-pastis prado","Juice the ingredients and pour into a chilled glass (do not use ice or the drink will lose body).

Top with Pastis Prado or absinthe and garnish with a sprig of mint.","1  half small cucumber, 1  medium carrot, 1  green apple, cored, 3-4  kale leaves, 1  big handful spinach leaves, 1  small hunk ginger, .5-pastis prado,fruity",fruity,3.082806984611417
484,Spring Forward,Champagne Flute,"old tom gin, noilly prat ambre vermouth, pineapple juice, lime juice, rich simple (2:1), .75 float dry sparkling wine","Combine all ingredients, minus the sparkling wine, into a tin. Shake and double strain into a flute glass. Top with a float of sparkling wine. Garnish with an edible flower petal.","old tom gin, noilly prat ambre vermouth, pineapple juice, lime juice, rich simple (2:1), .75 float dry sparkling wine,citrus,fruity,sweet","citrus, fruity, sweet",2.015249092775893
485,Stinger,,"1 part tempus fugit creme de menthe glaciale, 3 part h by hine",Shake or stir briskly and strain into a cocktail glass.,"1 part tempus fugit creme de menthe glaciale, 3 part h by hine",,2.5105584564061765
486,Stone Fruit Patch V1,,"luxardo maraschino liqueur, peach puree, lime juice, 3  raspberries",Muddle raspberries in mixing glass. Add remainder of ingredients in a mixing glass with fresh ice. Shake vigorously strain over fresh ice. Garnish with raspberry and mint.,"luxardo maraschino liqueur, peach puree, lime juice, 3  raspberries,citrus,fruity","citrus, fruity, sweet",3.606874391994777
487,Stone Fruit Patch V2,Coupe,"luxardo maraschino liqueur, peach puree, lime juice, 3  raspberries, sparkling wine",Muddle raspberries in mixing glass. Add remainder of ingredients in a mixing glass with fresh ice. Shake vigorously and strain into a well chilled coupe. Top off with sparkling wine. Garnish with raspberry and mint.,"luxardo maraschino liqueur, peach puree, lime juice, 3  raspberries, sparkling wine,citrus,fruity","citrus, fruity, sweet",1.7658904691371964
488,Stranger in the Alps,Rocks Glass,"rinse eau de vie, junipero gin, carpano antica, campari, braulio amaro, 1 pinch salt","Rinse a rocks glass with eau de vie. Combine remaining ingredients in a shaker with ice. Shake, and strain over fresh ice into a rocks glass. Garnish with a lemon pigtail.","rinse eau de vie, junipero gin, carpano antica, campari, braulio amaro, 1 pinch salt",salty,1.4871691301051204
489,Strike No.3,Old Fashioned Glass,"no.3 london dry gin, st. germaine elderflower liqueur, orgeat syrup, fresh lemon juice",Shake the ingredients with ice. Strain into an old fashioned glass. Garnish with a Luxardo Cherry.,"no.3 london dry gin, st. germaine elderflower liqueur, orgeat syrup, fresh lemon juice,citrus",citrus,2.0354708191823807
490,Stroll Through the Park,Collins,"barsol primero quebranta pisco, simple syrup, orange juice, lemon, 1 bsp el guapo tonic syrup, 4 dash el guapo tonic bitters, 3  cucumber slices, 2  mint sprig",Muddle mint and cucumber with the simple syrup in a shaker tin. Combine the remainder of the ingredients in the tin. Shake vigorously. Double strain with a fine mesh strainer into a collins glass. Fill with ice and garnish with a cucumber slice.,"barsol primero quebranta pisco, simple syrup, orange juice, lemon, 1 bsp el guapo tonic syrup, 4 dash el guapo tonic bitters, 3  cucumber slices, 2  mint sprig,citrus,sweet,bitter","bitter, citrus, herbaceous, sweet",1.787593123356336
491,Swedish 75,Coupe,"karlsson's gold vodka, lemon curd (or a large bar spoon), brut champagne","In a Boston shaker, combine the Karlsson's and the lemon curd with whole hard ice and shake vigorously for 30-40 seconds. Add the champagne to the shaker, stir until mixed well and double strain the cocktail into a 4.5 oz. coupe glass. Garnish the cocktail with a lemon twist making sure to release all the essential oils into the glass. Rub the entire rim with the twist before dropping the twist into the glass.","karlsson's gold vodka, lemon curd (or a large bar spoon), brut champagne,citrus",citrus,0.8818196332013429
492,Swedish Nightingale,,"no.3 london dry gin, maurin quina, pineapple gomme syrup, 1 bsp peated kola nut tincture, 2 dash angostura bitters",Stir. Strain. Lemon peel garnish.,"no.3 london dry gin, maurin quina, pineapple gomme syrup, 1 bsp peated kola nut tincture, 2 dash angostura bitters,fruity,bitter","bitter, fruity",1.677823974690566
493,Swedish Royal,Coupe,"karlsson's gold vodka, apricot brandy, dry vermouth, sweet vermouth",Combine all ingredients in a frozen mixing glass with hard ice and stir for 20 seconds. Strain into a frozen coupe glass.,"karlsson's gold vodka, apricot brandy, dry vermouth, sweet vermouth,fruity",fruity,0.8324693061125823
494,Tahitian Fix,Collins,"barsol selecto italia pisco, fresh lemon juice, vanilla agave nectar, pineapple gomme syrup, seltzer water",Shake all ingredients with ice and fine strain into Collins glass. Top with seltzer water and add lavender blossom garnish.,"barsol selecto italia pisco, fresh lemon juice, vanilla agave nectar, pineapple gomme syrup, seltzer water,citrus,fruity,sweet","citrus, fruity, sweet",1.8281887099051457
495,Tamaulipas Margarita,V-Shaped Rocks Glass,"chinaco blanco tequila, fresh lime juice, agave nectar","Served in v-shaped rocks glass with ""vintage ice"".
","chinaco blanco tequila, fresh lime juice, agave nectar,citrus,sweet","citrus, sweet",0.893756724803593
496,Tea & Sympathy,Mug,"avua amburana cachaça, king's ginger liqueur, fresh squeezed lemon juice, 1 bag chai tea","Soak 1 chai tea bag in half mug of hot water for 30 seconds, remove the tea bag, add all the ingredients, add more hot water. 

Lemon wheel stuffed with 4-5 cloves for garnish.","avua amburana cachaça, king's ginger liqueur, fresh squeezed lemon juice, 1 bag chai tea,citrus",citrus,1.6607953708106489
497,Tea Party Cocktail,Coupe,"no.3 london dry gin, king's ginger liqueur, orange marmalade syrup, lemon juice, bergamot tea foam","Shake all ingredients except foam, strain into chilled cocktail ""coupe"". Layer foam onto cocktail. Add garnish.","no.3 london dry gin, king's ginger liqueur, orange marmalade syrup, lemon juice, bergamot tea foam,citrus",citrus,1.8791035860444227
498,Temple of the Moon,Old Fashioned Glass,"junipero gin, barsol primero quebranta pisco, amaro sibilla, simple syrup,  rinse st. george absinthe, 3 drops fee brothers orange flower water","Stir all ingredients except for Absinthe and Orange Flower. Strain over a chunk/sphere of ice in an old fashioned glass. Garnish with a sprig of mint, with 3 drops of Orange Flower.","junipero gin, barsol primero quebranta pisco, amaro sibilla, simple syrup,  rinse st. george absinthe, 3 drops fee brothers orange flower water,citrus,sweet","citrus, sweet",1.6385205556984106
499,Tequila Sunflare,Rocks Glass,"chinaco blanco tequila, sage-cilantro-lime syrup,  rinse montanaro vermouth , 1  pomegranate ice cube",Pre-freeze pomegranate juice into one large cube. Rinse a glass with Montanaro vermouth. Dump any excess out. Build the remainder of spirits and bitters into a shaker tin. Shake vigorously. Strain over the pomegranate ice cube into a rocks glass.,"chinaco blanco tequila, sage-cilantro-lime syrup,  rinse montanaro vermouth , 1  pomegranate ice cube,citrus,herbaceous","citrus, herbaceous",1.552916677545625
500,Tequila Sunrise,Highball glass,"tequila,orange juice,grenadine","Pour the tequila and orange juice into glass over ice. Add the grenadine, which will sink to the bottom. Stir gently to create the sunrise effect. Garnish and serve.","tequila,orange juice,grenadine,citrus",citrus,1.3065120650833586
501,The Alpine Mist,Martini,"mezcal, reed's premium ginger brew,  seedless blackberry jam, 1  lime, juiced, 12  mint leaves, muddled",Fill a cocktail shaker with ice. Add all ingredients except the garnish and shake well. Stain into a very chilled martini glass (martini glass should have a sugar rim on half of the glass) and top with a splash of ginger beer. Garnish with a mint leaf and orange peel. Right before serving drop in a chip of dry ice for the mist.,"mezcal, reed's premium ginger brew,  seedless blackberry jam, 1  lime, juiced, 12  mint leaves, muddled,citrus,fruity","citrus, fruity, herbaceous",3.750215511987397
502,The Asterisk,Cocktail Glass,"brandy, green chartreuse, luxardo maraschino liqueur, lemon juice",Shake until very cold; double strain into a chilled cocktail glass. No garnish.,"brandy, green chartreuse, luxardo maraschino liqueur, lemon juice,citrus","citrus, sweet",1.733609188051784
503,The Awen,Rocks Glass,"pot still-style irish whiskey, luxardo maraschino liqueur, cocchi americano, 1 dash orange bitters",Stir ingredients in glass over an ice sphere.,"pot still-style irish whiskey, luxardo maraschino liqueur, cocchi americano, 1 dash orange bitters,floral,citrus,bitter","bitter, citrus, floral, sweet",8.746325411916876
504,The Bacchus Cocktail,Coupe,"5  concord grapes, 3  blackberries, barsol primero quebranta pisco, crème yvette, lemon juice, egg white","Place the Concord grapes and blackberries in a shaker and muddle. Add the rest of the ingredients and ice. Shake, and strain into a chilled coupe. Garnish with Concord grapes and lemon peel twisted to release oils.","5  concord grapes, 3  blackberries, barsol primero quebranta pisco, crème yvette, lemon juice, egg white,citrus,fruity","citrus, fruity",2.613200315564182
505,The Big Picture,,"tempus fugit alessio vino chinato, fig-infused c. drouin calvados selection, lemon, simple syrup",Build in glass. Add crushed ice and swizzle. Top with more crushed ice. Dash pepita tincture on top for aromatics. Garnish with lemon wheel and dried fig.,"tempus fugit alessio vino chinato, fig-infused c. drouin calvados selection, lemon, simple syrup,citrus,sweet","citrus, sweet",1.7160101317950238
506,The Bitter King,Martini,"king's ginger liqueur, lemon juice, simple syrup","Add all ingredients to a shaker, add ice, shake and strain into a martini glass garnish with a Luxardo Cherry.","king's ginger liqueur, lemon juice, simple syrup,citrus,sweet","citrus, sweet",2.0377368394547584
507,The Bittered Valley,,"luxardo maraschino liqueur, 4 drops acid phosphate, barsol primero quebranta pisco, luxardo amaro abano, luxardo fernet, 3 dash scrappy's aromatic bitters","1st glass ingredients:
Luxardo Maraschino, Acid Phosphate

2nd glass ingredients:
BarSol Quebranta Pisco, Luxardo Amaro Abano, Luxardo Fernet, Scrappy's Aromatic Bitters","luxardo maraschino liqueur, 4 drops acid phosphate, barsol primero quebranta pisco, luxardo amaro abano, luxardo fernet, 3 dash scrappy's aromatic bitters,bitter","bitter, sweet",8.003514182997685
508,The Boys of Summer Cup,Collins,"no.3 london dry gin, dolin rouge vermouth, the genuine curacao liqueur orange, king's ginger liqueur, chareau liqueur, fresh lemon juice,  top fever-tree bitter lemon",Top with Fever-Tree Bitter Lemon. Build in a collins glass full of ice cubes and garnish with a lemon wheel and mint sprig.,"no.3 london dry gin, dolin rouge vermouth, the genuine curacao liqueur orange, king's ginger liqueur, chareau liqueur, fresh lemon juice,  top fever-tree bitter lemon,citrus,bitter","bitter, citrus",1.800198368122511
509,The Brightside,Old Fashioned Glass,"pink pigeon rum, fresh orange juice,  luxardo bitter, 1 dash milk powder (or cream)","Dry shake, then serve old-fashioned glass with crushed ice. Drizzle Bitter on top to finish.","pink pigeon rum, fresh orange juice,  luxardo bitter, 1 dash milk powder (or cream),citrus,bitter","bitter, citrus",3.226603871434523
510,The Canevari Cocktail,Cocktail Glass,"old tom gin, cocchi vermouth di torino, luxardo bitter, 3 dash angostura bitters","Combine ingredients, stir until well chilled, and strain in to a cocktail glass. Serve with an orange twist.","old tom gin, cocchi vermouth di torino, luxardo bitter, 3 dash angostura bitters,bitter",bitter,1.522733743928058
511,The Cappa,Wine Glass,"gin, pineau des charentes, luxardo maraschino liqueur","Add all the ingredients to a mixing glass and fill with ice. Stir, and strain into a small wine or cocktail glass. Twist a slice of lemon peel over the drink and use as garnish.","gin, pineau des charentes, luxardo maraschino liqueur",sweet,0.7358091896168094
