,Cocktail Name,Glass,Ingredients,Instructions,combined,flavors,popularity
261,Japonais No.3,Highball Glass,"no.3 london dry gin, king's ginger liqueur, orange juice, 1 dash simple syrup, 2  cucumber slices, muddled, 2  raspberries, muddled","Muddle two cucumber slices, two raspberries and simple syrup in a highball, add ice. Shake gin, ginger liqueur and orange juice with ice. Strain into highball glass.  Garnish with a candied ginger stick.","no.3 london dry gin, king's ginger liqueur, orange juice, 1 dash simple syrup, 2  cucumber slices, muddled, 2  raspberries, muddled,citrus,sweet","citrus, sweet",2.019221507457159
262,Jitterbug,Cocktail Glass,"gin,vodka,grenadine,lime juice,sugar,sugar syrup,soda water","Wet glass, dip rim in sugar. Then add Ice. Then add everything else. It's that simple!","gin,vodka,grenadine,lime juice,sugar,sugar syrup,soda water,citrus,sweet","citrus, sweet",9.910410745264103
263,Julia's Child,Cocktail Glass,"broker's gin, karlsson's gold vodka, celery root puree, fresh lemon juice, simple syrup, 3 dash apple bitters, 1 dash angostura bitters","Add all ingredients to a shaker and shake with ice, then double strain into a cocktail glass. Garnish with a celery leaf.","broker's gin, karlsson's gold vodka, celery root puree, fresh lemon juice, simple syrup, 3 dash apple bitters, 1 dash angostura bitters,citrus,fruity,sweet,bitter","bitter, citrus, fruity, sweet",1.9979168812224015
264,Juniperotivo,Cocktail Glass,"junipero gin, simple syrup, lime juice, pomegranate syrup, 4 large mint leaves","In mixing glass, using a spoon, crush 2 mint leaves in the simple syrup, and add gin, lime juice and pomegranate syrup. Pour into ice-filled shaker. Shake well and strain into chilled cocktail glass. Float remaining 2 mint leaves for garnish.","junipero gin, simple syrup, lime juice, pomegranate syrup, 4 large mint leaves,citrus,sweet","citrus, herbaceous, sweet",4.45997812075901
265,Kanazawa,Cocktail Glass,"nikka coffey grain whisky, dry vermouth, luxardo amaro abano, 1 bsp luxardo maraschino liqueur, 1 dash angostura bitters","Stir all ingredients until well chilled, and strain into a chilled cocktail glass.
Garnish with an orange peel with oils squeeze over cocktail.","nikka coffey grain whisky, dry vermouth, luxardo amaro abano, 1 bsp luxardo maraschino liqueur, 1 dash angostura bitters,bitter","bitter, sweet",8.54360635871739
266,Karlsson's Mule,Copper mug,"karlsson's gold vodka, lime juice , ginger beer","Add vodka and lime juice to drinking glass, add ice, and top with ginger beer. Garnish with a lime.","karlsson's gold vodka, lime juice , ginger beer,citrus",citrus,3.702483527814268
267,Karlsson's Old Fashioned,,"karlsson's gold vodka, 1 cube brown sugar, 1 splash bitter","Put a brown sugar cube at the bottom of a frosted glass.
Add a splash of bitter and muddle the sugar.
Add Karlsson's Gold Vodka and stir with ice.
Add lemon and orange peels (which you can burn for added flavor).","karlsson's gold vodka, 1 cube brown sugar, 1 splash bitter,sweet,bitter","bitter, sweet",7.710409669074238
268,Karlsson's Winter Punch,,"bottle karlsson's gold vodka, pomegranate juice, cranberry juice, aperol, simple syrup (equal parts sugar and water), 3  star anise, 5  cloves, 4  allspice berries, 3  cinnamon sticks, orange peel","Toast spices and set aside. Bring cranberry juice to a simmer. Tie the spices and orange peel in cheesecloth and add them to the cranberry juice. Let this simmer for about 30 minutes. Remove the spice sachet and add the other liquid ingredients. Serve warm or chilled with orange wheels as a garnish. (The magic of punches is that you can adjust them to your liking as you make them, so please play around with different juices and proportions.)","bottle karlsson's gold vodka, pomegranate juice, cranberry juice, aperol, simple syrup (equal parts sugar and water), 3  star anise, 5  cloves, 4  allspice berries, 3  cinnamon sticks, orange peel,citrus,herbaceous,fruity,sweet","citrus, fruity, herbaceous, sweet",3.6188237427769456
269,Kay Pacha Mi Pacha,Martini,"barsol supremo moste verde italia pisco, no.3 london dry gin, luxardo maraschino liqueur, lemon juice, 2 dash angostura orange bitters",Shake all ingredients with ice. Double strain into a chilled Martini glass. Garnish with a Luxardo Maraschino cherry.,"barsol supremo moste verde italia pisco, no.3 london dry gin, luxardo maraschino liqueur, lemon juice, 2 dash angostura orange bitters,citrus,bitter","bitter, citrus, sweet",9.292953130832652
270,Kentucky Likker,Old Fashioned Glass,"hirsch small batch reserve bourbon, luxardo amaro abano, 2 dash orange bitters, 1 splash club soda","Pour the ingredients in an old fashioned glass, then fill up with ice and stir well before serving.","hirsch small batch reserve bourbon, luxardo amaro abano, 2 dash orange bitters, 1 splash club soda,citrus,bitter","bitter, citrus",9.1505247832825
271,Kentucky Mai Tai,Highball Glass,"mezcal, bourbon, lemon, peche de vigne, cynar, orgeat, 4 dash angostura bitters","Shake, strain over crushed ice in a highball. Garnish with a mint sprig and a cherry.","mezcal, bourbon, lemon, peche de vigne, cynar, orgeat, 4 dash angostura bitters,citrus,bitter","bitter, citrus",13.38593822417051
272,Kick the Pigeon,Champagne Flute," oz pink pigeon rum,  oz st. germaine elderflower liqueur,  oz lemon ,  oz vanilla syrup,  oz prosecco",Build and serve in a champagne flute.," oz pink pigeon rum,  oz st. germaine elderflower liqueur,  oz lemon ,  oz vanilla syrup,  oz prosecco,floral,citrus","citrus, floral, sweet",3.718049236046697
273,Kind of Fancy,Canadian Glencairn Glass,"h by hine, wild turkey 101 rye, bin 27 port, yellow chartreuse, 2 dash mole bitters",Stir ingredients with ice and strain into Canadian Glencairn glass.,"h by hine, wild turkey 101 rye, bin 27 port, yellow chartreuse, 2 dash mole bitters,bitter",bitter,1.3160097742499526
274,King's Medicine,Coupe,"king's ginger liqueur, lemon juice, luxardo fernet, benriach curiositas single malt 10 yo","Shake, strain into a chilled coupe. Garnish with lemon twist.","king's ginger liqueur, lemon juice, luxardo fernet, benriach curiositas single malt 10 yo,citrus",citrus,1.6344634046703244
275,King's Snap the Chocolate Out of You,Rocks Glass,"king's ginger liqueur, homemade milk chocolate, hazelnut cinnamon syrup,  oz marshmallow whip cream,  oz ginger snaps",Add all ingredients except the whip cream and ginger snap. Shake and double into a rocks glass with no ice. Top with marshmallow whip cream. Garnish with Ginger snap crumbles.,"king's ginger liqueur, homemade milk chocolate, hazelnut cinnamon syrup,  oz marshmallow whip cream,  oz ginger snaps",,1.4973067226758354
276,King's Toddy,Mug,"no.3 london dry gin, lemon juice, king's ginger liqueur, clover honey syrup","Combine ingredients into a hot mug, top with hot water and garnish with a rough orange twist.","no.3 london dry gin, lemon juice, king's ginger liqueur, clover honey syrup,citrus,herbaceous,sweet","citrus, herbaceous, sweet",2.0672941924432187
277,Kir,,"1 part briottet creme de cassis, 4 part chilled dry white wine","Add room temperature Creme de Cassis to the glass first, followed by the wine.","1 part briottet creme de cassis, 4 part chilled dry white wine",,3.919536195250077
278,Kir Royale,,"1 part briottet creme de cassis, 4 part chilled dry champagne","Add room temperature Creme de Cassis to the glass first, followed by the Champagne.","1 part briottet creme de cassis, 4 part chilled dry champagne",,3.4444186332279187
279,Kiss,Martini,"gin, sweet vermouth, dubonnet rouge, luxardo maraschino liqueur","Add all the ingredients to a mixing glass and fill with ice. Stir, and strain into a martini glass. Garnish with an apple slice.","gin, sweet vermouth, dubonnet rouge, luxardo maraschino liqueur",sweet,0.822268660084156
280,Kiss Of Persuasion,Coupe,"luxardo maraschino liqueur, honey-pear liqueur, heavy cream,  oz pinch of cardamom,  oz dehydrated pear slice",Pre-mix the liquors together and keep refrigerated. Serve 2 oz. neat into a small coupe glass. Float the fresh cream on top.,"luxardo maraschino liqueur, honey-pear liqueur, heavy cream,  oz pinch of cardamom,  oz dehydrated pear slice,fruity,sweet","fruity, sweet",2.652945793878294
281,Knockemdown Key,,"english harbour rum, briottet creme de banane, luxardo maraschino liqueur, lime juice, 1 bsp rich simple syrup",Shake and strain into small cocktail glass.,"english harbour rum, briottet creme de banane, luxardo maraschino liqueur, lime juice, 1 bsp rich simple syrup,citrus,sweet","citrus, sweet",4.038109135877801
282,Kumquat Smash,,"luxardo triplum (triple sec), ypioca brasilizar cachaca prata classica, luxardo sour cherry syrup (previously amarena), 5  kumquats, 1 float mango flavored rum",Muddle the fruit with syrup in a mixing glass. Add ice and shake vigorously. Pour all ingredients(do not strain) in a tumbler glass. Add a float of Mango flavored Rum.,"luxardo triplum (triple sec), ypioca brasilizar cachaca prata classica, luxardo sour cherry syrup (previously amarena), 5  kumquats, 1 float mango flavored rum,fruity",fruity,2.540019303397677
283,L.E.S. Is More,Highball Glass,"karlsson's gold vodka, esprit de june, fresh lemon juice, simple syrup","Combine all liquid ingredients in a highball or Collins glass with ice.
Stir lightly and garnish with a lemon twist making sure to release all the essential oils out of the twist. Also make sure to rub the entire rim of the glass with the twist before dropping it into the cocktail.","karlsson's gold vodka, esprit de june, fresh lemon juice, simple syrup,citrus,sweet","citrus, sweet",2.0354708191823807
284,L'Aviation,Martini,"no.3 london dry gin, luxardo maraschino liqueur, tempus fugit liqueur de violettes, fresh lemon juice",Place ingredients in a shaker with ice and shake hard for seven seconds. Double strain into a chilled martini glass and garnish with lemon peel.,"no.3 london dry gin, luxardo maraschino liqueur, tempus fugit liqueur de violettes, fresh lemon juice,floral,citrus","citrus, floral, sweet",1.9832377501035796
285,La Capilla,Double Rocks Glass,"mezcal, pierre ferrand curaçao, gordy’s cocktail pickle brine, watermelon juice, fresh grapefruit juice, fresh lime juice","Pour ingredients in a shaker tin, add ice and shake well. 

Fine strain the drink into a double rocks glass filled with ice.
 
Balance a small watermelon triangle on top of the glass. Grate fresh lime zest on top using a microplane, and then sprinkle with Maldon salt.","mezcal, pierre ferrand curaçao, gordy’s cocktail pickle brine, watermelon juice, fresh grapefruit juice, fresh lime juice,citrus,fruity","citrus, fruity, salty",1.6344634046703244
286,La Chiara,Collins,"luxardo bitter bianco, barsol primero quebranta pisco, fever-tree indian tonic, 1 dash luxardo maraschino liqueur",Build spirits in a tall glass over clear ice. Top with tonic and garnish with a lemon twist curled into a flower if you're feeling fancy.,"luxardo bitter bianco, barsol primero quebranta pisco, fever-tree indian tonic, 1 dash luxardo maraschino liqueur,bitter","bitter, sweet",7.809946990716602
287,La Hops Vie,Martini,"hophead vodka, fresh lemon juice, fresh grapefruit juice, simple syrup,   gin barrel aged orange bitters,   fresh basil leaves","Combine all ingredients in a shaker and shake until proper dilution. Double strain into a chilled martini or coupe glass and garnish with 2 fresh basil leaves that have been lightly ""spanked"" to release aromatics.","hophead vodka, fresh lemon juice, fresh grapefruit juice, simple syrup,   gin barrel aged orange bitters,   fresh basil leaves,citrus,fruity,sweet,bitter","bitter, citrus, fruity, herbaceous, sweet",1.9604345493708029
288,La La Land,Old Fashioned Glass,"karlsson's gold vodka, aperol, raspberry/white pepper syrup, fresh lemon juice, fresh cucumber juice, 4-5 pc fresh mint, 2 dashes celery bitters","In a mixing glass muddle mint, add all other ingredients and ice, shake, fine strain into a double old fashioned glass over fresh cracked ice. Garnish with cucumber slices and raspberries.","karlsson's gold vodka, aperol, raspberry/white pepper syrup, fresh lemon juice, fresh cucumber juice, 4-5 pc fresh mint, 2 dashes celery bitters,citrus,fruity,bitter","bitter, citrus, fruity, herbaceous",1.6669526372412125
289,La Madrugada,Coupe,"barsol perfecto amor (aperitif wine), lemon juice, luxardo amaro abano, luxardo maraschino liqueur",Combine all ingredients in a mixing glass and add ice. Shake well and double strain and serve into a coupe.,"barsol perfecto amor (aperitif wine), lemon juice, luxardo amaro abano, luxardo maraschino liqueur,citrus","citrus, sweet",1.6607953708106489
290,La Maracuja,,"ypioca brasilizar cachaca prata reserva especial, fresh passion fruit, condense milk, brown sugar syrup (2:1)",Add all ingredients to blender and blend throughly. Double strain into a glass with cracked ice garnish with a mint sprig and fresh grated nutmeg.,"ypioca brasilizar cachaca prata reserva especial, fresh passion fruit, condense milk, brown sugar syrup (2:1),sweet",sweet,8.702789594555936
291,La Nueva Moda (The New Fashion),Rocks Glass,"chinaco anejo tequila, mezcal, luxardo maraschino liqueur, 2 drops agave nectar, 3 dash fee brothers aztec chocolate bitters, 2 cubes sugar","In rocks glass, make an emulsion by using a glass muddler (wood muddlers absorb the ingredients too much). Place sugar cubes in glass. Add mezcal onto the cubes. Add bitters, onto cubes. Add drops of agave nectar, onto cubes. Add Luxardo, onto cubes. Muddle well to make a ""syrup"" paying attention the blending of all ingredients. 
Take the long orange peel and twist all the essential oils into glass. Leave peel in glass. 
Place Gläce Luxury Ice G-Cubed in glass. Rotate Gläce G-Cubed so that it becomes coated and chills the ""syrup"" swirl around the inside of glass. Pour the Anejo Tequila over Gläce G-Cubed. Stir with glass swizzle. Garnish with 3 Luxardo Cherries, speared.","chinaco anejo tequila, mezcal, luxardo maraschino liqueur, 2 drops agave nectar, 3 dash fee brothers aztec chocolate bitters, 2 cubes sugar,sweet,bitter","bitter, sweet",8.38391676970926
292,Last Samurai,Cocktail Glass,"vodka, gin, luxardo maraschino liqueur, cointreau",Shake. Serve up. Garnish with lime wheel.,"vodka, gin, luxardo maraschino liqueur, cointreau",sweet,0.8476914000447386
293,Last Word,Cocktail Glass,"luxardo maraschino liqueur, junipero gin, green chartreuse, fresh lime juice",Shake all ingredients with ice then strain into a chilled cocktail glass.,"luxardo maraschino liqueur, junipero gin, green chartreuse, fresh lime juice,citrus","citrus, sweet",1.786243269764337
294,Le Femme Nikita,Rocks Glass,"nikka whisky taketsuru pure malt 12 yo, rich cane syrup, 2 dash bittermens xocolatl mole bitters, 2 dash cinnamon bitters",Build in rocks glass. Use cylinder ice cube.,"nikka whisky taketsuru pure malt 12 yo, rich cane syrup, 2 dash bittermens xocolatl mole bitters, 2 dash cinnamon bitters,bitter",bitter,8.091737537484127
295,Le Sang et Sable,Stemmed Cordial Glass,"h by hine, dubonnet rouge, cherry herring, blood orange juice, lemon juice",Add all ingredients to a shaker and fill with ice. Shake vigorously and strain into chilled stemmed cordial glass. Garnish with cocktail cherry and lemon twist.,"h by hine, dubonnet rouge, cherry herring, blood orange juice, lemon juice,citrus,fruity","citrus, fruity",0.8712878642394465
296,Lemon Drop,Cocktail glass,"absolut vodka,cointreau,lemon",Shake and strain into a chilled cocktail glass rimmed with sugar.,"absolut vodka,cointreau,lemon,citrus",citrus,1.3065120650833586
297,Little Ground Tapper,Old Fashioned Glass,"h by hine, small hand foods pineapple gum syrup, 1 bsp luxardo maraschino liqueur, 2 dash angostura bitters",Build in an old fashioned glass over ice. Garnish with orange peel.,"h by hine, small hand foods pineapple gum syrup, 1 bsp luxardo maraschino liqueur, 2 dash angostura bitters,fruity,bitter","bitter, fruity, sweet",8.605517660147253
298,Local Edition Punch,,"12 bottles h by hine, 4 bottles luxardo apricot liqueur, 1 bottle king's ginger liqueur, 1 bottle luxardo aperitivo, 4 bottles lemon juice",Combine all ingredients in a punch bowl. Mix well.,"12 bottles h by hine, 4 bottles luxardo apricot liqueur, 1 bottle king's ginger liqueur, 1 bottle luxardo aperitivo, 4 bottles lemon juice,citrus,fruity","citrus, fruity",1.5861702357737395
299,Lonesome George,Wine Glass,"apricot-infused h by hine, napoleon amontillado, mandarine napoléon, lazzaroni amaro",Stir with Ice and strain into a small wine glass.,"apricot-infused h by hine, napoleon amontillado, mandarine napoléon, lazzaroni amaro,fruity",fruity,3.206186998788157
300,Long Division,Champagne Flute,"tequila, luxardo maraschino liqueur, aperol, lime juice",Shake. Serve up. Top with sparkling rose. Garnish with lime peel.,"tequila, luxardo maraschino liqueur, aperol, lime juice,citrus","citrus, sweet",0.9074423275639776
301,Long Island Limoncello Martini,,"hangar 1 buddha's hand citron vodka, luxardo limoncello, fresh lemon juice, monin cane syrup",Served up and finished with a lemon wheel.,"hangar 1 buddha's hand citron vodka, luxardo limoncello, fresh lemon juice, monin cane syrup,citrus",citrus,1.797556858919723
302,Lost at Sea,Collins,"king's ginger liqueur, lime juice, cane sugar syrup, club soda","Muddle basil in mixing glass, add all ingredients except club soda. Shake and strain into a collins glass, top with club soda.  Top with crushed ice and garnish with a basil sprig.","king's ginger liqueur, lime juice, cane sugar syrup, club soda,citrus,sweet","citrus, sweet",4.145027889629806
303,Lovage In The Garden,Rocks Glass,"hophead vodka, 3  sun gold cherry tomatoes, 4  lovage leaves, lime juice, agave syrup (1:1 agave to water), luxardo aperitivo, 1 pinch hepps ghost pepper salt",Muddle everything in a tin except Hophead. Then add Hophead and ice and shake and strain into a rocks glass with ice and garnish with a lovage sprig.,"hophead vodka, 3  sun gold cherry tomatoes, 4  lovage leaves, lime juice, agave syrup (1:1 agave to water), luxardo aperitivo, 1 pinch hepps ghost pepper salt,citrus,fruity,sweet","citrus, fruity, salty, sweet",3.715573385756138
304,Lux Cherry Sparkler,Champagne Flute,"luxardo sangue morlacco cherry liqueur, prosecco","Add the Cherry Liqueur to a flute, top with Prosecco, and garnish with a Luxardo Maraschino Cherry.","luxardo sangue morlacco cherry liqueur, prosecco,floral,fruity","floral, fruity",2.54923961853657
305,Lux Japanese Lemonade,Copita Glass,"no.3 london dry gin, jummai ginjo sake, luxardo limoncello, dill cordial, meyer lemon juice, yuzu juice, fresh egg white","Dry Shake, add ice and shake for 10 seconds. Double strain into a Copita Glass. Garnish with Dill.","no.3 london dry gin, jummai ginjo sake, luxardo limoncello, dill cordial, meyer lemon juice, yuzu juice, fresh egg white,citrus",citrus,1.8281887099051457
306,Lux Orchard Lemonade,,"luxardo maraschino liqueur, junipero gin, monin apple puree, lemon juice, 1 dash fennel bitters",Add all ingredients in a mixing glass with fresh ice. Shake vigorously and strain over fresh ice. Garnish with Luxardo Cherry.,"luxardo maraschino liqueur, junipero gin, monin apple puree, lemon juice, 1 dash fennel bitters,citrus,herbaceous,fruity,bitter","bitter, citrus, fruity, herbaceous, sweet",1.753006342297856
307,Lux Shandy,Highball Glass,"luxardo aperitivo, lemon juice, orange juice, simple syrup,  top anchor california lager",Add all ingredients to a mixing glass. Add ice and integration shake. Pour over fresh ice into a highball and top with California Lager. Garnish with a half orange wheel.,"luxardo aperitivo, lemon juice, orange juice, simple syrup,  top anchor california lager,citrus,sweet","citrus, sweet",1.8794955198839216
308,Luxardo Fresco,Wine Glass,"luxardo maraschino liqueur, 1 strip cucumber, 1 dash lemon juice,  top tonic",Quick stir and garnish with rosemary.,"luxardo maraschino liqueur, 1 strip cucumber, 1 dash lemon juice,  top tonic,citrus","citrus, sweet",1.733609188051784
309,Luxardo Ice Cream Float,Lowball Glass,"luxardo cherry syrup (from jar of cherries), 1 scoop vanilla ice cream,  top soda water","Build syrup and ice cream in a lowball cocktail glass, and top with soda water. Serve with a metal straw, a spoon, and garnish with a Luxardo Maraschino Cherry.","luxardo cherry syrup (from jar of cherries), 1 scoop vanilla ice cream,  top soda water,fruity","fruity, sweet",2.676176243770213
310,Luxardo Maraschino Simple Spritz,,"luxardo maraschino liqueur, squeeze of lime , italian sparkling water","Build over ice, stir lightly, and garnish with a lime twist and a Luxardo Cherry.","luxardo maraschino liqueur, squeeze of lime , italian sparkling water,citrus","citrus, sweet",8.000191607106366
311,Luxardo Sling,Tumbler,"luxardo sangue morlacco cherry liqueur, no.3 london dry gin, grapefruit juice, 1 fill soda water","Shake well in a shaker, serve in a tumbler filled with ice. Top with soda water.","luxardo sangue morlacco cherry liqueur, no.3 london dry gin, grapefruit juice, 1 fill soda water,fruity",fruity,1.6607953708106489
312,Luxardo Sour,Old Fashioned Glass,"luxardo amaretto di saschira, rye whiskey, lemon juice, angostura bitters, 1  egg white",Dry shake all ingredients for 20-30 seconds. Then shake with ice. Double strain over fresh ice in an old fashioned glass. Garnish with wide lemon swath.,"luxardo amaretto di saschira, rye whiskey, lemon juice, angostura bitters, 1  egg white,citrus,bitter","bitter, citrus",9.1505247832825
313,Malibu Twister,Highball glass,"malibu rum,tropicana,cranberry juice","Add rum & trister then, add cranberry jucie,stir","malibu rum,tropicana,cranberry juice,fruity",fruity,2.977580470178065
314,Mandrake,Coupe,"barsol primero quebranta pisco, barsol perfecto amor (aperitif wine), leopold bros. bitter, velvet falernum,   red hawaiian salt","Barrel aged in a used bourbon barrel that previously held a cocktail containing Hine Cognac and Luxardo Bitter.

Stir with ice and strain into a small coupe. Garnish with an orange twist.","barsol primero quebranta pisco, barsol perfecto amor (aperitif wine), leopold bros. bitter, velvet falernum,   red hawaiian salt,bitter","bitter, salty",1.852397576610408
315,Manhattan,Cocktail glass,"sweet vermouth,bourbon,angostura bitters,ice,maraschino cherry,orange peel","Stirred over ice, strained into a chilled glass, garnished, and served up.","sweet vermouth,bourbon,angostura bitters,ice,maraschino cherry,orange peel,citrus,fruity,bitter","bitter, citrus, fruity, sweet",2.0706332120937523
316,Manhattan,Old Fashioned Glass,"rye or bourbon whiskey, tempus fugit spirits alessio vermouth di torino, 2 dash tempus fugit abbott's bitters",Stir and strain. Garnish with a Luxardo Maraschino Cherry.,"rye or bourbon whiskey, tempus fugit spirits alessio vermouth di torino, 2 dash tempus fugit abbott's bitters,bitter",bitter,2.0706332120937523
317,Maraschino Side Car,,"luxardo maraschino liqueur, dry curacao, bourbon rye, lemon juice",Add ingredients in a mixing glass with fresh ice. Shake vigorously strain over fresh ice. Garnish with lemon peel to fit in glass and 1 dash of Abbott's Aromatic Bitters. Optional sugar rim.,"luxardo maraschino liqueur, dry curacao, bourbon rye, lemon juice,citrus","citrus, sweet",1.786243269764337
318,Marchesa,Old Fashioned Glass,"luxardo maraschino liqueur, bitter, luxardo sangue morlacco cherry liqueur, bourbon, 2 dash chocolate bitters",Prepare directly in an old fashioned glass.,"luxardo maraschino liqueur, bitter, luxardo sangue morlacco cherry liqueur, bourbon, 2 dash chocolate bitters,fruity,bitter","bitter, fruity, sweet",8.318508570105115
319,Maria Canevari Punch,,"luxardo maraschino liqueur, luxardo apricot liqueur, fresh lemon juice, simple syrup, perfect puree white peach, soda water",Mix all ingredients together.,"luxardo maraschino liqueur, luxardo apricot liqueur, fresh lemon juice, simple syrup, perfect puree white peach, soda water,citrus,fruity,sweet","citrus, fruity, sweet",1.8870640713384053
320,Martinez,Coupe,"old tom gin, tempus fugit alessio vermouth di torino rosso, luxardo maraschino liqueur, 2 dash tempus fugit abbott's bitters","Add all ingredients to a shaker and fill with ice. Shake, and strain into a chilled coupe glass.","old tom gin, tempus fugit alessio vermouth di torino rosso, luxardo maraschino liqueur, 2 dash tempus fugit abbott's bitters,bitter","bitter, sweet",1.5910188234688998
321,Martinez,Cocktail Glass,"old tom gin, tempus fugit alessio vermouth di torino rosso, luxardo maraschino liqueur, 2 dash orange bitters","Combine ingredients in an ice-filled mixing glass and stir for 20 to 30 seconds, or until well chilled. Strain into a chilled cocktail glass and garnish with the lemon peel.","old tom gin, tempus fugit alessio vermouth di torino rosso, luxardo maraschino liqueur, 2 dash orange bitters,citrus,bitter","bitter, citrus, sweet",1.5910188234688998
322,Martinez Cocktail,Cocktail glass,"gin,dry vermouth,triple sec,orange bitters,cherry",Stir all ingredients (except cherry) with ice and strain into a cocktail glass. Top with the cherry and serve.,"gin,dry vermouth,triple sec,orange bitters,cherry,citrus,fruity,bitter","bitter, citrus, fruity",0.9267645292846134
323,Martini,Cocktail glass,"gin,dry vermouth,olive","Straight: Pour all ingredients into mixing glass with ice cubes. Stir well. Strain in chilled martini cocktail glass. Squeeze oil from lemon peel onto the drink, or garnish with olive.","gin,dry vermouth,olive",salty,1.3064241022431862
324,Mary Pickford,Cocktail glass,"light rum,pineapple juice,maraschino liqueur,grenadine,maraschino cherry",Shake and strain into a chilled large cocktail glass,"light rum,pineapple juice,maraschino liqueur,grenadine,maraschino cherry,fruity","fruity, sweet",3.0609251947574685
